<?xml version="1.0" ?>

<serializer xmlns="http://symfony.com/schema/dic/serializer-mapping"
                    xmlns:xsi="http://www.w3.org/2001/XMLSchema-instance"
                    xsi:schemaLocation="http://symfony.com/schema/dic/serializer-mapping http://symfony.com/schema/dic/serializer-mapping/serializer-mapping-1.0.xsd">

    <class name="Symfony\Component\Serializer\Tests\Fixtures\GroupDummy">
        <attribute name="foo">
            <group>group1</group>
            <group>group2</group>
        </attribute>

        <attribute name="bar">
            <group>group2</group>
        </attribute>
    </class>

    <class name="Symfony\Component\Serializer\Tests\Fixtures\MaxDepthDummy">
        <attribute name="foo" max-depth="2" />
        <attribute name="bar" max-depth="3" />
    </class>

</serializer>
